{
  "generated_at": "2026-07-30T04:28:27Z",
  "items": [
    {
      "feed_id": "jvcea_news",
      "item_hash": "39d77f8678c58308b6186142a8ab30d0dcf133e7efcb42e4ea442e8d19507e67",
      "link": "https://jvcea.or.jp/information/statistics-reports/20260624-001/",
      "published_at": "2026-06-24T08:37:12Z",
      "source_id": "jvcea",
      "status": "queued",
      "summary": "<p>会員において新たに取り扱うに至った銘柄を以下へお知らせいたします。 電子決済手段</p> <p>The post <a href=\"https://jvcea.or.jp/information/statistics-reports/20260624-001/\">新規取扱銘柄のお知らせ</a> first appeared on <a href=\"https://jvcea.or.jp\">一般社団法人日本暗号資産等取引業協会（JVCEA）</a>.</p>",
      "title": "新規取扱銘柄のお知らせ"
    },
    {
      "feed_id": "jvcea_news",
      "item_hash": "598402eef0df276b0cd30be7285672bae58146affb37afcb93fcce7b8b3926fc",
      "link": "https://jvcea.or.jp/information/statistics-reports/20260701-001/",
      "published_at": "2026-06-30T23:00:00Z",
      "source_id": "jvcea",
      "status": "queued",
      "summary": "<p>移転制限が付された暗号資産の情報提供及び公表に関する規則第5条第3項に基づく公表について更新しました。 詳細につきましては、下記ページよりご確認ください。</p> <p>The post <a href=\"https://jvcea.or.jp/information/statistics-reports/20260701-001/\">移転制限が付された暗号資産の情報提供及び公表に関する規則第5条第3項に基づく公表について更新しました。</a> first appeared on <a href=\"https://jvcea.or.jp\">一般社団法人日本暗号資産等取引業協会（JVCEA）</a>.</p>",
      "title": "移転制限が付された暗号資産の情報提供及び公表に関する規則第5条第3項に基づく公表について更新しました。"
    },
    {
      "feed_id": "jvcea_news",
      "item_hash": "5ba424dd9bf40a039bb7fa1af63b0b52e0224dd49218fd6d8245caeae4a8b718",
      "link": "https://jvcea.or.jp/information/statistics-reports/20260623-001/",
      "published_at": "2026-06-23T03:00:00Z",
      "source_id": "jvcea",
      "status": "queued",
      "summary": "<p>取扱いを再開する銘柄と会員を以下へお知らせいたします。 暗号資産</p> <p>The post <a href=\"https://jvcea.or.jp/information/statistics-reports/20260623-001/\">取扱い再開のお知らせ</a> first appeared on <a href=\"https://jvcea.or.jp\">一般社団法人日本暗号資産等取引業協会（JVCEA）</a>.</p>",
      "title": "取扱い再開のお知らせ"
    },
    {
      "feed_id": "jvcea_news",
      "item_hash": "9337149a62026aac2bb1d455f842502c276cd33d8bc61fb1eeae9c658f38338f",
      "link": "https://jvcea.or.jp/information/statistics-reports/20260703-002/",
      "published_at": "2026-07-03T06:57:27Z",
      "source_id": "jvcea",
      "status": "queued",
      "summary": "<p>一般社団法人日本暗号資産等取引業協会にて集計・公表している統計情報について更新しました。 統計データの詳細につきましては、下記ページよりご確認ください。</p> <p>The post <a href=\"https://jvcea.or.jp/information/statistics-reports/20260703-002/\">会員統計情報を更新しました</a> first appeared on <a href=\"https://jvcea.or.jp\">一般社団法人日本暗号資産等取引業協会（JVCEA）</a>.</p>",
      "title": "会員統計情報を更新しました"
    },
    {
      "feed_id": "jvcea_news",
      "item_hash": "b47e53f3ef7c70251a33c882bb467c026b51f2640ae212a99c02c6892e8e34c1",
      "link": "https://jvcea.or.jp/information/statistics-reports/20260626-001/",
      "published_at": "2026-06-26T08:00:00Z",
      "source_id": "jvcea",
      "status": "queued",
      "summary": "<p>会員において新たに取り扱うに至った銘柄を以下へお知らせいたします。 暗号資産</p> <p>The post <a href=\"https://jvcea.or.jp/information/statistics-reports/20260626-001/\">新規取扱銘柄のお知らせ</a> first appeared on <a href=\"https://jvcea.or.jp\">一般社団法人日本暗号資産等取引業協会（JVCEA）</a>.</p>",
      "title": "新規取扱銘柄のお知らせ"
    },
    {
      "feed_id": "jvcea_news",
      "item_hash": "c0b5b33930b6c0233fcb8fe45b9bfb3626392f27026660f2a525b5be827fd5ac",
      "link": "https://jvcea.or.jp/information/statistics-reports/20260703-001/",
      "published_at": "2026-07-03T05:46:52Z",
      "source_id": "jvcea",
      "status": "queued",
      "summary": "<p>取扱いを一時中止する銘柄と会員を以下へお知らせいたします。 暗号資産</p> <p>The post <a href=\"https://jvcea.or.jp/information/statistics-reports/20260703-001/\">取扱い一時中止のお知らせ</a> first appeared on <a href=\"https://jvcea.or.jp\">一般社団法人日本暗号資産等取引業協会（JVCEA）</a>.</p>",
      "title": "取扱い一時中止のお知らせ"
    },
    {
      "feed_id": "fsa_news_en",
      "item_hash": "d43e90ec376c373ed97ad133d755ace57694ade27110015379b2da2d29e9e1b1",
      "link": "https://www.fsa.go.jp/policy/japanfintechweek/2026/index_en.html",
      "published_at": "2026-06-30T15:00:00Z",
      "source_id": "fsa",
      "status": "queued",
      "summary": "To showcase the appeal of Japan’s fintech industry to the global community and create new business opportunities for further development, Japan Fintech Week 2026 will be held from February 24th to March 6th. By collaborating with related events organized by various industry groups, this initiative aims to provide a platform where domestic and international fintech stakeholders can come together in one place.",
      "title": "Others,Updated Japan Fintech Week 2026 official website"
    },
    {
      "feed_id": "jvcea_news",
      "item_hash": "f8468ed1d08feed23ab5dc2305c138fc4dd0893fc5fd388f5cb56f76719ddd37",
      "link": "https://jvcea.or.jp/information/main-info/20260630-001/",
      "published_at": "2026-06-30T08:21:25Z",
      "source_id": "jvcea",
      "status": "queued",
      "summary": "<p>役員の任期満了に伴い、2026年6月30日に開催されました定時社員総会にて理事が新たに選任され、同日開催されました臨時理事会において会長及び専務理事が選任されましたので、お知らせいたします。 役員</p> <p>The post <a href=\"https://jvcea.or.jp/information/main-info/20260630-001/\">理事選任のお知らせ</a> first appeared on <a href=\"https://jvcea.or.jp\">一般社団法人日本暗号資産等取引業協会（JVCEA）</a>.</p>",
      "title": "理事選任のお知らせ"
    },
    {
      "feed_id": "jvcea_news",
      "item_hash": "f3e774dbc5cd978e3a5f27873db9360956913566b400e1d0dff0c5f2a716830e",
      "link": "https://jvcea.or.jp/information/statistics-reports/20260715-001/",
      "published_at": "2026-07-15T02:00:00Z",
      "source_id": "jvcea",
      "status": "queued",
      "summary": "<p>取扱いを廃止する銘柄と会員を以下へお知らせいたします。 暗号資産</p> <p>The post <a href=\"https://jvcea.or.jp/information/statistics-reports/20260715-001/\">取扱廃止銘柄のお知らせ</a> first appeared on <a href=\"https://jvcea.or.jp\">一般社団法人日本暗号資産等取引業協会（JVCEA）</a>.</p>",
      "title": "取扱廃止銘柄のお知らせ"
    },
    {
      "feed_id": "fsa_news_ja",
      "item_hash": "c76a29073c6cdbd98b64d2f565e2550e02c2ba4f1927968c8c4148eadae09401",
      "link": "https://www.fsa.go.jp/policy/bgin/innovationtop.html",
      "published_at": "2026-07-23T17:00:00Z",
      "source_id": "fsa",
      "status": "queued",
      "summary": "",
      "title": "「暗号資産関連業者におけるサイバーセキュリティの課題と対策に関する研究調査」報告書について公表しました。"
    },
    {
      "feed_id": "fsa_news_en",
      "item_hash": "cfc3b51a622b91081e4307db3c3250af7fbd07a3f60f40f1f549e898cffd081c",
      "link": "https://www.fsa.go.jp/en/policy/bgin/innovationtop.html",
      "published_at": "2026-07-23T17:00:00Z",
      "source_id": "fsa",
      "status": "queued",
      "summary": "",
      "title": "Publication,Cybersecurity Issues and Countermeasures in Crypto-Asset-Related Businesses"
    },
    {
      "feed_id": "fsa_news_ja",
      "item_hash": "5e195583759738a85790598055316f211348dc94dac0b98323984920bdd48621",
      "link": "https://www.fsa.go.jp/inter/fatf/20260716/20260716.html",
      "published_at": "2026-07-27T13:00:00Z",
      "source_id": "fsa",
      "status": "queued",
      "summary": "",
      "title": "国際関係,FATFによる「暗号資産及び暗号資産サービス・プロバイダー（VASP）に係るFATF基準の実施状況についての報告書」について公表しました。"
    },
    {
      "feed_id": "fsa_news_ja",
      "item_hash": "4aeb2648f9830554569a234d787238f40c3be9b41a91e1fd9382474b125b9036",
      "link": "https://www.fsa.go.jp/inter/fatf/20260721/20260721.html",
      "published_at": "2026-07-29T18:00:00Z",
      "source_id": "fsa",
      "status": "queued",
      "summary": "",
      "title": "国際関係,FATFによる「DeFiに係る規制上の課題に関する報告書」について公表しました。"
    }
  ],
  "jurisdiction_id": "jp",
  "schema_version": 1
}
