{
  "generated_at": "2026-07-27T23:54:22Z",
  "items": [
    {
      "feed_id": "fca_news",
      "item_hash": "cc6093a7b6b893511f35bda7f4e9eafff25a7b50d07a4c18f0c7f3c6ab73eebc",
      "link": "https://www.fca.org.uk/news/statements/fca-and-bank-england-set-out-approach-joint-regulation-systemic-stablecoin-issuers",
      "published_at": null,
      "source_id": "fca",
      "status": "queued",
      "summary": "The Bank of England and the FCA have published a joint approach setting out how they and where relevant other authorities will work together to regulate systemic stablecoin issuers in the UK.It explains how responsibilities will be split between the authorities, and how UK stablecoin issuers may move from FCA supervision to joint regulation once recognised as systemic by HM Treasury.The approach aims to provide clarity and predictability for firms as the market develops.Read the paper",
      "title": "FCA and the Bank of England set out approach to joint regulation of systemic stablecoin issuers"
    },
    {
      "feed_id": "hmt_activity",
      "item_hash": "2c13ae36166f94159592bb0cb316942ea06e0f52867b6e3864a59d2438dcd8e6",
      "link": "https://www.gov.uk/government/publications/wholesale-digital-markets-champion-first-report",
      "published_at": "2026-07-13T08:00:02Z",
      "source_id": "hmt",
      "status": "queued",
      "summary": "Report from the UK’s Wholesale Digital Markets Champion, setting out a framework for the UK financial sector to drive tokenisation of wholesale financial markets.",
      "title": "Independent report: Wholesale Digital Markets Champion – first report"
    },
    {
      "feed_id": "hmt_activity",
      "item_hash": "0f4c88c4edd97ef6c0bc158f482be945ec20d3eb2754e21d2a437436554257b5",
      "link": "https://www.gov.uk/government/publications/recommendations-of-the-transatlantic-taskforce-for-markets-of-the-future",
      "published_at": "2026-07-14T15:20:14Z",
      "source_id": "hmt",
      "status": "queued",
      "summary": "Recommendations of the Transatlantic Taskforce for Markets of the Future to advance UK-US financial services collaboration on digital assets and capital markets",
      "title": "Policy paper: Recommendations of the Transatlantic Taskforce for Markets of the Future"
    },
    {
      "feed_id": "hmt_activity",
      "item_hash": "3d85ae44714ca581dd4c1f90b8f7f3fc6abbe3e91977c726803c0c2deb2eab0d",
      "link": "https://www.gov.uk/government/publications/update-on-the-digital-gilt-instrument-digit-pilot-issuance",
      "published_at": "2026-07-16T12:00:00Z",
      "source_id": "hmt",
      "status": "queued",
      "summary": "The Chancellor announced that DIGIT will be issued by Q1 2027, and the government is taking steps to prepare for potential future issuances. HSBC and LSEG have signed an MoU to develop connectivity together to support investor access.",
      "title": "Policy paper: Update on the Digital Gilt Instrument (DIGIT) pilot issuance"
    }
  ],
  "jurisdiction_id": "uk",
  "schema_version": 1
}
